{
  "version": "2.3.0",
  "last_updated": "2026-05-03",
  "endpoints": [
    {
      "service": "Ada",
      "provider": "Ada Support",
      "category": "customer_support_ai",
      "risk_level": "medium",
      "domains": [
        "ada.cx",
        "ada.support"
      ],
      "description": "KI-Chatbot für Customer-Service",
      "source": "endpoint-refresh-2026-04"
    },
    {
      "service": "Adept AI",
      "provider": "Adept",
      "category": "ai_agent",
      "risk_level": "high",
      "domains": [
        "adept.ai",
        "app.adept.ai"
      ],
      "description": "Autonomer Browser-Agent — interagiert mit Webanwendungen",
      "source": "bulk-import-2026-04"
    },
    {
      "service": "Adobe Firefly",
      "provider": "Adobe",
      "category": "image_generation",
      "risk_level": "medium",
      "domains": [
        "firefly.adobe.com",
        "firefly-api.adobe.io"
      ],
      "description": "Adobes KI-Bildgenerierung, in Creative-Cloud integriert",
      "source": "bulk-import-2026-04"
    },
    {
      "service": "AgentGPT",
      "provider": "Reworkd",
      "category": "ai_agent",
      "risk_level": "high",
      "domains": [
        "agentgpt.reworkd.ai"
      ],
      "description": "Autonomer Task-Agent im Browser",
      "source": "bulk-import-2026-04"
    },
    {
      "service": "Aider",
      "provider": "Aider",
      "category": "code_assistant",
      "risk_level": "critical",
      "domains": [
        "aider.chat"
      ],
      "description": "CLI-basierter KI-Code-Assistent, arbeitet mit Git-Repos",
      "source": "bulk-import-2026-04"
    },
    {
      "service": "AIVA",
      "provider": "AIVA",
      "category": "audio_generation",
      "risk_level": "low",
      "domains": [
        "aiva.ai"
      ],
      "description": "KI-Komposition für Musik",
      "source": "bulk-import-2026-04"
    },
    {
      "service": "Akkio",
      "provider": "Akkio",
      "category": "data_analysis_ai",
      "risk_level": "high",
      "domains": [
        "akkio.com",
        "app.akkio.com"
      ],
      "description": "No-Code-KI-Datenanalyse für Business Teams",
      "source": "bulk-import-2026-04"
    },
    {
      "service": "Amazon Q Developer",
      "provider": "Amazon",
      "category": "code_assistant",
      "risk_level": "high",
      "domains": [
        "q.aws.amazon.com"
      ],
      "description": "AWS KI-Entwickler-Assistent (ehem. CodeWhisperer)",
      "aliases": [
        "CodeWhisperer"
      ],
      "source": "bulk-import-2026-04"
    },
    {
      "service": "Anthropic Claude",
      "provider": "Anthropic",
      "category": "llm_chatbot",
      "risk_level": "high",
      "domains": [
        "claude.ai",
        "api.anthropic.com",
        "cdn.anthropic.com",
        "console.anthropic.com"
      ],
      "description": "Claude AI Chatbot und API",
      "aliases": [
        "Anthropic",
        "Anthropic Claude",
        "Claude",
        "Claude.ai"
      ],
      "source": "initial-import-2026-q1"
    },
    {
      "service": "Anyword",
      "provider": "Anyword",
      "category": "content_generation",
      "risk_level": "medium",
      "domains": [
        "anyword.com",
        "app.anyword.com"
      ],
      "description": "KI-Copywriting für Marketing",
      "source": "bulk-import-2026-04"
    },
    {
      "service": "Artbreeder",
      "provider": "Artbreeder",
      "category": "image_generation",
      "risk_level": "low",
      "domains": [
        "artbreeder.com"
      ],
      "description": "Kollaborative KI-Bildgenerierung",
      "source": "bulk-import-2026-04"
    },
    {
      "service": "AssemblyAI",
      "provider": "AssemblyAI",
      "category": "speech_to_text",
      "risk_level": "high",
      "domains": [
        "assemblyai.com",
        "api.assemblyai.com"
      ],
      "description": "Enterprise Speech-to-Text API",
      "source": "bulk-import-2026-04"
    },
    {
      "service": "Atlassian Rovo",
      "provider": "Atlassian",
      "category": "enterprise_embedded",
      "risk_level": "medium",
      "domains": [
        "rovo.atlassian.com"
      ],
      "description": "KI in Jira/Confluence — verarbeitet Workspace-Inhalte (DPA vorhanden)",
      "source": "bulk-import-2026-04"
    },
    {
      "service": "AutoGPT",
      "provider": "Significant Gravitas",
      "category": "ai_agent",
      "risk_level": "high",
      "domains": [
        "agpt.co",
        "news.agpt.co"
      ],
      "description": "Autonomer LLM-Agent, selbstständige Task-Ausführung",
      "source": "bulk-import-2026-04"
    },
    {
      "service": "Avoma",
      "provider": "Avoma",
      "category": "meeting_ai",
      "risk_level": "high",
      "domains": [
        "avoma.com",
        "app.avoma.com"
      ],
      "description": "Meeting-Intelligence-Plattform",
      "source": "bulk-import-2026-04"
    },
    {
      "service": "Baichuan AI",
      "provider": "Baichuan",
      "category": "llm_chatbot",
      "risk_level": "critical",
      "domains": [
        "baichuan-ai.com",
        "api.baichuan-ai.com"
      ],
      "description": "Chinesischer LLM-Anbieter — Drittland-Transfer-Risiko",
      "source": "bulk-import-2026-04"
    },
    {
      "service": "Bardeen",
      "provider": "Bardeen",
      "category": "productivity_ai",
      "risk_level": "medium",
      "domains": [
        "bardeen.ai",
        "app.bardeen.ai"
      ],
      "description": "KI-gestützte Browser-Automation",
      "source": "bulk-import-2026-04"
    },
    {
      "service": "Beautiful.ai",
      "provider": "Beautiful.ai",
      "category": "presentation_ai",
      "risk_level": "medium",
      "domains": [
        "beautiful.ai",
        "app.beautiful.ai"
      ],
      "description": "KI-gestützter Präsentationsbuilder",
      "source": "bulk-import-2026-04"
    },
    {
      "service": "Bolt.new",
      "provider": "StackBlitz",
      "category": "code_assistant",
      "risk_level": "critical",
      "domains": [
        "bolt.new"
      ],
      "description": "KI-Full-Stack-Entwicklung im Browser",
      "source": "bulk-import-2026-04"
    },
    {
      "service": "Boomy",
      "provider": "Boomy",
      "category": "audio_generation",
      "risk_level": "low",
      "domains": [
        "boomy.com"
      ],
      "description": "KI-Musikgenerierung für Creator",
      "source": "bulk-import-2026-04"
    },
    {
      "service": "Browse AI",
      "provider": "Browse AI",
      "category": "productivity_ai",
      "risk_level": "medium",
      "domains": [
        "browse.ai"
      ],
      "description": "KI-Web-Scraping ohne Code",
      "source": "bulk-import-2026-04"
    },
    {
      "service": "Canva Magic Studio",
      "provider": "Canva",
      "category": "enterprise_embedded",
      "risk_level": "medium",
      "domains": [
        "canva.com/magic",
        "www.canva.com"
      ],
      "description": "KI-Funktionen in Canva — Text-to-Image, Magic Write",
      "source": "bulk-import-2026-04"
    },
    {
      "service": "Character.AI",
      "provider": "Character Technologies",
      "category": "llm_chatbot",
      "risk_level": "medium",
      "domains": [
        "character.ai",
        "beta.character.ai"
      ],
      "description": "Rollenspiel-LLM mit User-erstellten Charakteren",
      "source": "bulk-import-2026-04"
    },
    {
      "service": "ChatGLM",
      "provider": "Zhipu AI",
      "category": "llm_chatbot",
      "risk_level": "critical",
      "domains": [
        "chatglm.cn",
        "open.bigmodel.cn"
      ],
      "description": "Chinesischer Open-Source-LLM — Drittland-Transfer-Risiko",
      "source": "bulk-import-2026-04"
    },
    {
      "service": "Chronicle",
      "provider": "Chronicle",
      "category": "presentation_ai",
      "risk_level": "medium",
      "domains": [
        "chroniclehq.com"
      ],
      "description": "KI-Präsentations-Builder mit Template-Fokus",
      "source": "bulk-import-2026-04"
    },
    {
      "service": "Civitai",
      "provider": "Civitai",
      "category": "image_generation",
      "risk_level": "medium",
      "domains": [
        "civitai.com"
      ],
      "description": "Community-Hub für Stable-Diffusion-Modelle",
      "source": "bulk-import-2026-04"
    },
    {
      "service": "Cline",
      "provider": "Cline",
      "category": "code_assistant",
      "risk_level": "critical",
      "domains": [
        "cline.bot"
      ],
      "description": "Autonomer KI-Coder als VS Code Extension",
      "source": "bulk-import-2026-04"
    },
    {
      "service": "Codeium",
      "provider": "Exafunction",
      "category": "code_assistant",
      "risk_level": "critical",
      "domains": [
        "codeium.com",
        "server.codeium.com",
        "inference.codeium.com"
      ],
      "description": "KI-Code-Completion, IDE-Extensions",
      "source": "bulk-import-2026-04"
    },
    {
      "service": "Cognosys",
      "provider": "Cognosys",
      "category": "ai_agent",
      "risk_level": "high",
      "domains": [
        "cognosys.ai"
      ],
      "description": "Autonomer Research-Agent",
      "source": "bulk-import-2026-04"
    },
    {
      "service": "Cohere",
      "provider": "Cohere",
      "category": "llm_api",
      "risk_level": "high",
      "domains": [
        "cohere.com",
        "api.cohere.ai",
        "dashboard.cohere.com"
      ],
      "description": "Enterprise LLM API — Text-Analyse und Generierung",
      "source": "initial-import-2026-q1"
    },
    {
      "service": "Continue.dev",
      "provider": "Continue",
      "category": "code_assistant",
      "risk_level": "critical",
      "domains": [
        "continue.dev"
      ],
      "description": "Open-Source-KI-Code-Assistent, IDE-Integration",
      "source": "bulk-import-2026-04"
    },
    {
      "service": "Copy.ai",
      "provider": "Copy.ai",
      "category": "content_generation",